year,unit,case,amount,url
2021,臺南市政府農業局,臺南市農業旅遊宣傳推廣,2000000,http://web.pcc.gov.tw/prkms/prms-viewTenderDetailClient.do?ds=20210106&fn=BDM-1-53302116.xml
2020,臺南市政府勞工局,關子嶺勞工育樂中心促參前置作業委託專業服務案,2768000,http://web.pcc.gov.tw/prkms/prms-viewTenderDetailClient.do?ds=20201118&fn=BDM-1-53243603.xml
2020,臺南市中西區公所,臺南市中西區109年度里鄰長文康暨訓練活動,1236000,http://web.pcc.gov.tw/prkms/prms-viewTenderDetailClient.do?ds=20200131&fn=BDM-1-53005142.xml
2021,臺南市政府觀光旅遊局,110年臺南市推廣農業旅遊元件宣傳輔導計畫,2990000,http://web.pcc.gov.tw/prkms/prms-viewTenderDetailClient.do?ds=20211021&fn=BDM-1-53531990.xml
2020,臺南市政府觀光旅遊局,台南米其林美食指南國際媒體擴大宣傳委託專業服務案,2800000,http://web.pcc.gov.tw/prkms/prms-viewTenderDetailClient.do?ds=20201211&fn=BDM-1-53269580.xml
