year,unit,case,amount,url
2020,臺南市立大成國民中學,臺南市立大成國民中學109學年度三年級戶外教育活動勞務採購,1048000,http://web.pcc.gov.tw/prkms/prms-viewTenderDetailClient.do?ds=20201112&fn=BDM-1-53238006.xml
2019,臺南市立大成國民中學,臺南市立大成國民中學108學年度一、二年級師生戶外教育活動勞務採購,1415000,http://web.pcc.gov.tw/prkms/prms-viewTenderDetailClient.do?ds=20191004&fn=BDM-1-52886783.xml
2021,臺南市東區崇學國民小學,台南市學校教室冷氣設備裝設採購案,84482400,http://web.pcc.gov.tw/prkms/prms-viewTenderDetailClient.do?ds=20210503&fn=BDM-1-53390968.xml
2021,臺南市東區崇學國民小學,台南市學校教室冷氣設備裝設採購案,844824000,http://web.pcc.gov.tw/prkms/prms-viewTenderDetailClient.do?ds=20210511&fn=BDM-1-53398830.xml
2020,臺南市中西區進學國民小學,109-110年度進學國小A棟教室1、A棟教室2、A棟教室3、D棟教室1、D棟教室2、D棟教室3補強工程委託設計監造技術服務勞務採購案,1420762,http://web.pcc.gov.tw/prkms/prms-viewTenderDetailClient.do?ds=20200304&fn=BDM-1-53029040.xml
2021,臺南市中西區永福國民小學,臺南市中西區永福國小110年度新設戶外遊戲場大型組合遊具組財物採購案,1300000,http://web.pcc.gov.tw/prkms/prms-viewTenderDetailClient.do?ds=20210720&fn=BDM-1-53457413.xml
2021,臺南市歸仁區歸仁國民小學,臺南市歸仁國小110年度兒童遊戲場改善計畫財物採購案,1300000,http://web.pcc.gov.tw/prkms/prms-viewTenderDetailClient.do?ds=20210426&fn=BDM-1-53385139.xml
