year,unit,case,amount,url
2021,臺南市政府工務局,110年度臺南市政府工務局委託隧道檢(監)測評估服務工作,2830000,http://web.pcc.gov.tw/prkms/prms-viewTenderDetailClient.do?ds=20211028&fn=BDM-1-53537522.xml
2021,臺南市玉井區公所,110年度玉井區公共工程(含災害復建工程)委託設計監造開口契約,3360000,http://web.pcc.gov.tw/prkms/prms-viewTenderDetailClient.do?ds=20210114&fn=BDM-1-53310227.xml
2019,臺南市新市區公所,新市區109年度本所預算暨補助經費委託設計監造開口契約,3150000,http://web.pcc.gov.tw/prkms/prms-viewTenderDetailClient.do?ds=20191227&fn=BDM-1-52973692.xml
2021,臺南市政府環境保護局,110年臺南市廢棄物設施暨災後復建工程委託設計及監造開口合約,5640000,http://web.pcc.gov.tw/prkms/prms-viewTenderDetailClient.do?ds=20210604&fn=BDM-1-53419830.xml
2020,臺南市停車管理處,臺南市東區文化中心停E5立體停車場新建工程,321584234,http://web.pcc.gov.tw/prkms/prms-viewTenderDetailClient.do?ds=20200821&fn=BDM-1-53172209.xml
