year,unit,case,amount,url
2021,臺南市政府水利局,臺南市水資源回收中心廠站設備延壽及節能工程,75500000,http://web.pcc.gov.tw/prkms/prms-viewTenderDetailClient.do?ds=20210722&fn=BDM-1-53459759.xml
2021,臺南市政府消防局,臺南市政府消防局110年度救災指揮車採購案,6250000,http://web.pcc.gov.tw/prkms/prms-viewTenderDetailClient.do?ds=20210415&fn=BDM-1-53376102.xml
2021,臺南市政府消防局,臺南市政府消防局110年度紅外線熱顯像空拍無人機組(含訓練機)採購案,2390000,http://web.pcc.gov.tw/prkms/prms-viewTenderDetailClient.do?ds=20210226&fn=BDM-1-53340392.xml
2021,臺南市政府消防局,臺南市政府消防局110年度救災現場遠端監控資訊系統採購案,4000000,http://web.pcc.gov.tw/prkms/prms-viewTenderDetailClient.do?ds=20210106&fn=BDM-1-53300435.xml
2021,臺南市政府環境保護局,110年度臺南市柴油車動力計排煙檢測及污染管制計畫,22039000,http://web.pcc.gov.tw/prkms/prms-viewTenderDetailClient.do?ds=20210510&fn=BDM-1-53396927.xml
